{
    "images": [
        "images/splash/background.png",
        "images/splash/disclaimer.png",
        "images/splash/loadingpie_unfilled.png",
        "images/splash/loadingpie_filled.png",
        "images/splash/loadingpie_overlay.png",
        "images/splash/logo.png"
    ],
    "sprites": [
        "sprites/splash/background.json",
        "sprites/splash/disclaimer.json",
        "sprites/splash/loadingpie_unfilled.json",
        "sprites/splash/loadingpie_filled.json",
        "sprites/splash/loadingpie_overlay.json",
        "sprites/splash/logo.json"
    ],
    "sounds": [
        "sounds/button_highlight.ogg"
    ],
    "sound_events": [
        "sound_events/button_hover.json"
    ],
    "music": [
        "music/MenuMusic.ogg",
        "music/GameMusic1.ogg",
        "music/GameMusic2.ogg",
        "music/GameMusic3.ogg",
        "music/15toGoMusic_1.ogg",
        "music/15toGoMusic_2.ogg"
    ],
    "colorPalettes": [
        "images/particles/wild_pal.png"
    ]
}